;ID;ENLACE;USUARIO;@CUENTA;FECHA;RETWEETS;FAVORITO;MENCIONA;HASHTAGS;GEO;TEXTO
630;1075862748096012288;https://twitter.com/CartonPiedraET/status/1075862748096012288;CartonPiedraET;;2018-12-20 21:17:22+00:00;0;0;@el_telegrafo;;;Loja será sede permanente del Festival Internacional de las Artes Vivas: http://tinyurl.com/y7yhlpqx en @el_telegrafo.
631;1075862522127884290;https://twitter.com/CartonPiedraET/status/1075862522127884290;CartonPiedraET;;2018-12-20 21:16:28+00:00;3;1;@el_telegrafo;;;El Festival de las Artes vivas de Loja ya tiene informe de la Contraloría y continuará realizándose en esa ciudad: http://tinyurl.com/yd6v8j42 en @el_telegrafo.
632;1075854577180831744;https://twitter.com/acostabogados/status/1075854577180831744;acostabogados;AndreSamaniego_;2018-12-20 20:44:54+00:00;1;3;;;;Pero es de Perogrullo, el festival de las artes vivas de Loja TIENE que estar en Loja 
633;1075830907582451713;https://twitter.com/JoaoBaylonS/status/1075830907582451713;JoaoBaylonS;Jeanninecruzz;2018-12-20 19:10:50+00:00;0;0;@Jeanninecruzz;;;Excelente Asambleísta @Jeanninecruzz estuve en Loja hace poco en el tercer festival de artes vivas, viajé desde Esmeraldas a Loja para conocer de la cultura nacional, internacional y local de la Centinela del Sur, como ecuatoriano quedo agradecido por su labor de continuar FIAVL
634;1075829276728061952;https://twitter.com/edurobayo7/status/1075829276728061952;edurobayo7;;2018-12-20 19:04:22+00:00;0;0;;;;En 2017 el Festival de Artes Vivas de Loja movió más de 3 millones de dólares en la economía de la ciudad. Verónica Arias, ponente del proyecto de Ley, da detalles de este evento que se organiza cada año en Loja. Vía: rgrvelez 
635;1075828144182042624;https://twitter.com/elcomerciocom/status/1075828144182042624;elcomerciocom;;2018-12-20 18:59:52+00:00;8;18;@rgrvelez;;;En 2017 el Festival de Artes Vivas de Loja movió más de 3 millones de dólares en la economía de la ciudad. Verónica Arias, ponente del proyecto de Ley, da detalles de este evento que se organiza cada año en Loja. Vía: @rgrvelez
636;1075817975243030534;https://twitter.com/edurobayo7/status/1075817975243030534;edurobayo7;;2018-12-20 18:19:27+00:00;0;0;;;;Por unanimidad (con 101 votos de 101 legisladores presentes), la Asamblea aprueba Ley para la Institucionalización del Festival de Artes Vivas de Loja. La asambleísta Jeanine Cruz explica en qué consiste. El documento será remitido al Ejecutivo. Vía rgrv… 
637;1075817198722146309;https://twitter.com/elcomerciocom/status/1075817198722146309;elcomerciocom;;2018-12-20 18:16:22+00:00;27;70;@rgrvelez;;;Por unanimidad (con 101 votos de 101 legisladores presentes), la Asamblea aprueba Ley para la Institucionalización del Festival de Artes Vivas de Loja. La asambleísta Jeanine Cruz explica en qué consiste. El documento será remitido al Ejecutivo. Vía @rgrvelez
638;1075817074671435786;https://twitter.com/VistoLoja/status/1075817074671435786;VistoLoja;;2018-12-20 18:15:52+00:00;25;36;@veronicaariasf;#FestivalArtesVivas #Loja;;¡Se institucionaliza el Festival de Artes Vivas! Con 101 votos afirmativos, el Pleno de la Asamblea aprueba el Proyecto de Ley para la Institucionalización del #FestivalArtesVivas en #Loja. El proyecto lo presentó la asambleísta @veronicaariasf. Cada año la sede será Loja 
639;1075814389977178112;https://twitter.com/Robertm29/status/1075814389977178112;Robertm29;;2018-12-20 18:05:12+00:00;7;10;@veronicaariasf;#Loja;;Aprobado por una nimidad ley para que el festival internacional de las artes vivas de Loja se mantenga en #Loja. Gracias Sra. Asambleísta @veronicaariasf por hacer realidad este proyectó... 
640;1075812816387538944;https://twitter.com/AndreSamaniego_/status/1075812816387538944;AndreSamaniego_;;2018-12-20 17:58:57+00:00;95;197;@AsambleaEcuador @teleamazonasec;;;La @AsambleaEcuador aprueba por unanimidad ley para que el festival internacional de las artes vivas de Loja se mantenga en Loja. La votación @teleamazonasec
641;1075804162275856385;https://twitter.com/edurobayo7/status/1075804162275856385;edurobayo7;;2018-12-20 17:24:34+00:00;0;0;;;;El Pleno de la Asamblea realiza el segundo y definitivo debate del proyecto de Ley para la Institucionalización del Festival de Artes Vivas de Loja, que desde 2016 se organiza en esta ciudad. Byron Suquilanda (Creo) defiende la propuesta. Vía rgrvelez 
642;1075803294516289538;https://twitter.com/elcomerciocom/status/1075803294516289538;elcomerciocom;;2018-12-20 17:21:07+00:00;0;1;@rgrvelez;;;El Pleno de la Asamblea realiza el segundo y definitivo debate del proyecto de Ley para la Institucionalización del Festival de Artes Vivas de Loja, que desde 2016 se organiza en esta ciudad. Byron Suquilanda (Creo) defiende la propuesta. Vía @rgrvelez
643;1075722983447109632;https://twitter.com/esthercuestasan/status/1075722983447109632;esthercuestasan;;2018-12-20 12:01:59+00:00;6;15;@AsambleaEcuador;#Sesi #Sesi;;En #Sesión564 @AsambleaEcuador entrega condecoración póstuma a Miguel Tankamash y conoceremos Informe 2do Debate de Proyecto de Ley para Institucionalizar Festival de Artes Vivas de Loja.En #Sesión558 debatiremos Resolución de declaratoria de emergencia de sector lechero nacional 
644;1075459068058320897;https://twitter.com/AlldoAf/status/1075459068058320897;AlldoAf;;2018-12-19 18:33:17+00:00;0;0;;#fiavl2018;;"Por lo menos a la clausura #fiavl2018 en Festival De Las Artes Vivas Loja 2017. Tours . https://www.instagram.com/p/BqptpCLgM-EBi-zQhtwhQkn6tVEAdpwJ9G7Dag0/?utm_source=ig_twitter_share&amp;igshid=3v5aonlgvrd3"
645;1075453664528121863;https://twitter.com/DiegoOchoaMz/status/1075453664528121863;DiegoOchoaMz;veronicaariasf;2018-12-19 18:11:49+00:00;0;1;;;;Este jueves el pleno de la Asamblea Nacional resolverá en segundo y definitivo debate la institucionalización del Festival Internacional de Artes Vivas de Loja. 
646;1075077121863770112;https://twitter.com/veronicaariasf/status/1075077121863770112;veronicaariasf;;2018-12-18 17:15:34+00:00;21;50;;#FIAVL #LojaDefiendeElFestival;;Este jueves el pleno de la Asamblea Nacional resolverá en segundo y definitivo debate la institucionalización del Festival Internacional de Artes Vivas de Loja #FIAVL. #LojaDefiendeElFestival.
647;1075052018551742464;https://twitter.com/AndreSamaniego_/status/1075052018551742464;AndreSamaniego_;;2018-12-18 15:35:49+00:00;12;10;@teleamazonasec;#Loja;;Este jueves se debate en segunda instancia la ley para la institucionalidad del festival internacional de las artes vivas de #Loja se espera que sea aprobada para que el festival se quede allá @teleamazonasec
648;1075031300887797766;https://twitter.com/RafaelQuijijeAN/status/1075031300887797766;RafaelQuijijeAN;;2018-12-18 14:13:29+00:00;4;3;@EducacionAN;;;Presente en la sesión No. 043 @EducacionAN orden del día: Conocimiento, observaciones, análisis, debate y votación del Informe para segundo debate del Proyecto de Ley para la Institucionalización del Festival Internacional de Artes Vivas de Loja. 
649;1075023488233152513;https://twitter.com/Danza_Ec/status/1075023488233152513;Danza_Ec;;2018-12-18 13:42:27+00:00;0;0;;;;"Compartimos con ustedes una crítica de Genoveva Mora Toral sobre ""Línea y contorno de un abismo"", una coproducción de la Compañía Nacional de Danza y el Festival Internacional de Artes Vivas Loja, basada en el concepto y dirección de Laura Aris. https://www.facebook.com/cnde.danza/posts/671734829910184"
650;1073365471725056000;https://twitter.com/miregionec/status/1073365471725056000;miregionec;;2018-12-13 23:54:05+00:00;0;0;;#Loja;;#Loja Casa Carrión El proyecto casa Carrión que está planificado edificarse en la antigua vivienda de Benjamín Carrión, la idea principal es convertir a esta casa en un escenario más del Festival Internacional de Artes Vivas.
651;1072937208670248961;https://twitter.com/AngelToOficial/status/1072937208670248961;AngelToOficial;veronicaariasf;2018-12-12 19:32:19+00:00;1;6;@veronicaariasf;#LojaDefiendeElFestival;;#LojaDefiendeElFestival El Festival Internacional de Artes Vivas debe quedarse en nuestra ciudad, ya que Loja representa lo que es la cultura, la música y el Arte. @veronicaariasf
652;1072651332916523015;https://twitter.com/primereporte/status/1072651332916523015;primereporte;;2018-12-12 00:36:21+00:00;2;3;;;;"El proyecto de Ley de Institucionalización del Festival de Artes Vivas de Loja, fue presentado por Asambleísta en el pleno de la Asamblea Nacional. Más detalles en: http://bit.ly/ProyectoInstitucionalizaci&#xF3;n "
653;1072603919539494912;https://twitter.com/paolacheese/status/1072603919539494912;paolacheese;;2018-12-11 21:27:57+00:00;0;1;;#Ecuador #Loja;;por qué será que en #Ecuador se piensa que todo debe estar regulado con una ley, hasta un festival como el de las artes vivas de #Loja! no será más fácil hacer el festival y que sea cada vez mejor, así la gente lo va a pedir siempre! sin que eso se diga en una ley..
654;1072550770027978752;https://twitter.com/veronicaariasf/status/1072550770027978752;veronicaariasf;;2018-12-11 17:56:45+00:00;3;17;;#AsambleaNacional #LojaDefiendeElFestival;;Inicia la sesión #560, donde el Pleno de la #AsambleaNacional analizará en primer debate el proyecto de Ley de Institucionalización del Festival de Artes Vivas de Loja. Transmisión en radio de Asamblea 95.7 FM o por la página web: https://www.asambleanacional.gob.ec. #LojaDefiendeElFestival.
655;1072533838545502208;https://twitter.com/lodelmomentoloj/status/1072533838545502208;lodelmomentoloj;;2018-12-11 16:49:28+00:00;5;9;;#Loja #LDMnoticias;;#Loja | Hoy en el Pleno de la Asamblea se debatirá la institucionalización del Festival de Artes Vivas Proyecto que busca garantizar que la sede permanente sea Loja, como lo ah sido durante tres años consecutivos, así como la asignación de recursos para su ejecución #LDMnoticias
656;1072512009290350595;https://twitter.com/Rubn_Bustamante/status/1072512009290350595;Rubn_Bustamante;;2018-12-11 15:22:43+00:00;20;18;;#Loja #lojadefiendeelfestival;;Hoy en el Pleno de la Asamblea debatiremos la institucionalización del Festival Internacional de Artes Vivas, proyecto que busca garantizar que la sede permanente sea #Loja, así como la asignación de recursos para su ejecución. #lojadefiendeelfestival
657;1072502368376377345;https://twitter.com/esthercuestasan/status/1072502368376377345;esthercuestasan;;2018-12-11 14:44:25+00:00;3;4;@MashiRafael;#Sesi;;Hoy en #Sesión560 conoceremos el Informe para Primer Debate del Proyecto de Ley que garantice continuidad y sostenibilidad del Festival de las Artes Vivas en la querida Loja, creado por impulso de nuestro compañero ex Presidente @MashiRafael Esto no podrán destruir los odiadores!
658;1072195530770538496;https://twitter.com/tomebamba/status/1072195530770538496;tomebamba;;2018-12-10 18:25:09+00:00;0;0;;;;Institucionalización del Festival Internacional de Artes Vivas de Loja se debatirá este martes en Asamblea Nacional. http://ow.ly/cqnu30mVQYt | Ecuainm
659;1072191952668495872;https://twitter.com/FERSATELITAL/status/1072191952668495872;FERSATELITAL;;2018-12-10 18:10:56+00:00;0;0;@AsambleaEcuador;#Loja;;El proyecto de institucionalización del Festival de Artes Vivas de #Loja se debate mañana, desde las 11:00 en la @AsambleaEcuador.
660;1072191113778348040;https://twitter.com/infoloja1/status/1072191113778348040;infoloja1;;2018-12-10 18:07:36+00:00;0;0;;#InfoLoja #Loja #AsambleaNacional;;MAÑANA SE DEBATE EN LA ASAMBLEA INSTITUCIONALIZACIÓN DEL FESTIVAL DE LOJA #InfoLoja | El proyecto de institucionalización del Festival de Artes Vivas de #Loja será debatido mañana desde las 11h00 por el pleno de la #AsambleaNacional.
661;1072190374888828929;https://twitter.com/ecuainm_oficial/status/1072190374888828929;ecuainm_oficial;;2018-12-10 18:04:40+00:00;3;5;@AsambleaEcuador;;;"Institucionalización del Festival Internacional de Artes Vivas de Loja se debatirá este martes en .@AsambleaEcuador Además, buscarán declarar el 12 de diciembre como Día de la Gastronomía y Productos Saludables http://ecuadorinmediato.com/index.php?module=Noticias&amp;func=news_user_view&amp;id=2818847456&amp;umt=institucionalizacion_del_festival_internacional_artes_vivas_loja_se_debatira_martes_en_asamblea_nacional"
662;1072167080613609472;https://twitter.com/SiguemeLoja/status/1072167080613609472;SiguemeLoja;;2018-12-10 16:32:06+00:00;0;0;;#Loja;;#Loja | El martes 11 de diciembre, 11h00, se debatirá en el pleno de la asamblea, el primer informe del proyecto de institucionalización del Festival de Artes Vivas de Loja. 
663;1071183682520657920;https://twitter.com/amatoniosalinas/status/1071183682520657920;amatoniosalinas;;2018-12-07 23:24:26+00:00;0;0;@YouTube;;;Culmina el Festival de Artes Vivas en Loja https://youtu.be/VCtdn2JwU6g vía @YouTube
664;1071182371779735552;https://twitter.com/amatoniosalinas/status/1071182371779735552;amatoniosalinas;;2018-12-07 23:19:13+00:00;0;0;@YouTube;;;Festival de Artes Vivas en Loja recibe a cientos de turistas https://youtu.be/Fld2ZvkalyM vía @YouTube
665;1070325528647925760;https://twitter.com/SantiCueva/status/1070325528647925760;SantiCueva;DavilaAurelio;2018-12-05 14:34:26+00:00;0;0;@MunicipioQuito;;;De acuerdo en la primera parte. Hace menos de un mes estuve en el Festival de Artes Vivas de Loja y al final del desfile de comparsas habían cuadrillas de limpieza del Municipio. Es viable y es lógico y el @MunicipioQuito debería emularlo.
666;1069993278920163328;https://twitter.com/veronicaariasf/status/1069993278920163328;veronicaariasf;;2018-12-04 16:34:11+00:00;177;351;;#Loja #LojaDefiendeElFestival;;#Loja se convirtió nuevamente en un gran escenario del arte y la cultura. Aquí un recorrido por sus coloridas calles durante la III edición del Festival Internacional de Artes Vivas. #LojaDefiendeElFestival.
667;1069939494349099009;https://twitter.com/lachanchazul/status/1069939494349099009;lachanchazul;;2018-12-04 13:00:28+00:00;0;0;@FestivalDeLoja;#LaChanchaRecomienda #Loja #ArtesVivas;;¡Estuvimos en el @FestivalDeLoja! Aquí te contamos un poco de nuestra experiencia con el Festival de Artes Vivas, sus obras, sus artistas y la ciudad #LaChanchaRecomienda #Loja #ArtesVivas
668;1069765722014998529;https://twitter.com/pedroide/status/1069765722014998529;pedroide;;2018-12-04 01:29:58+00:00;0;0;;#aquicitonomas #festival #artes #vivas #arte #efimero #tiza #carb #Loja #Ecuador;;"Efimeros. Tiza y carbón sobre asfalto. Festival de las artes vivas. Fotos por constanzeklinghammer #aquicitonomas #festival #artes #vivas #arte #efimero #tiza #carbón #Loja #Ecuador en… https://www.instagram.com/p/Bq8mzpLn1Ra/?utm_source=ig_twitter_share&amp;igshid=zf1xi4l9krka"
669;1069425688455847937;https://twitter.com/juliohidalgojp/status/1069425688455847937;juliohidalgojp;rgdelat;2018-12-03 02:58:47+00:00;1;6;;;;Amigo, hay miles de ciudades en el mundo que dinamizan su economía sin acudir a los toros. Pidales a sus autoridades un poco de creatividad, en Loja por ejemplo se creo el Festival de Artes vivas y les va bien. No añoren fiestas sádicas. Si no tienen imaginación, copien.
670;1069397051581042689;https://twitter.com/__soylili/status/1069397051581042689;__soylili;;2018-12-03 01:05:00+00:00;0;0;;;;"Festival Internacional de artes vivas Loja 2018 en Parque Jipiro Loja https://www.instagram.com/p/Bq5_UjphJO4/?utm_source=ig_twitter_share&amp;igshid=2407ud062763"
671;1068329186463383552;https://twitter.com/ecuainm_oficial/status/1068329186463383552;ecuainm_oficial;;2018-11-30 02:21:41+00:00;1;2;@ecuainm;;;Primer Festival Sensorial Interactivo se inaugura en Quito (AUDIO): Tras su paso por el Festival Internacional de Artes Vivas Loja 2018, el colectivo Confundamiento inaugura este jueves 29 de noviembre en Quito el primer Festival Sensorial… http://bit.ly/2Qtzm4T @ecuainm
672;1068214322290147330;https://twitter.com/veronicaariasf/status/1068214322290147330;veronicaariasf;;2018-11-29 18:45:15+00:00;12;21;@AsambleaEcuador;#Loja #LojaDefiendeElFestival;;La aprobación del informe del proyecto de Ley para institucionalizar el Festival Internacional de Artes Vivas ha generado gran expectativa en #Loja. #LojaDefiendeElFestival @AsambleaEcuador
673;1067757367608123400;https://twitter.com/jjmlawfirm/status/1067757367608123400;jjmlawfirm;;2018-11-28 12:29:29+00:00;1;1;;;;Se institucionalizará el Festival de Artes Vivas y fomentará un programa nacional de cultura en el país denominado Camino a Loja https://jjmlawfirm.wordpress.com/2018/11/28/se-institucionalizara-el-festival-de-artes-vivas-y-fomentara-un-programa-nacional-de-cultura-en-el-pais-denominado-camino-a-loja/
674;1067609607214899200;https://twitter.com/MunicipioDeLoja/status/1067609607214899200;MunicipioDeLoja;;2018-11-28 02:42:20+00:00;23;45;;#Loja #MunicipioDeLoja #LojaDefiendeElFestival #FIAVL2019;;#Loja #MunicipioDeLoja #LojaDefiendeElFestival | Por reunir a todas las artes. ¡Gracias Loja! El Festival de Artes Vivas nació en Loja y se quedará en Loja. Los esperamos en el #FIAVL2019
675;1067600811918802944;https://twitter.com/srradioEc/status/1067600811918802944;srradioEc;;2018-11-28 02:07:23+00:00;0;0;;;;Se institucionalizará el Festival de Artes Vivas y fomentará un programa nacional de cultura en el país denominado camino a Loja – SR Radio https://www.srradio.com.ec/se-institucionalizara-el-festival-de-artes-vivas-y-fomentara-un-programa-nacional-de-cultura-en-el-pais-denominado-camino-a-loja/
676;1067572457480040449;https://twitter.com/VistoLoja/status/1067572457480040449;VistoLoja;;2018-11-28 00:14:43+00:00;28;36;@veronicaariasf;;;¡Buscan institucionalizar Festival de Artes Vivas en Loja! La Comisión de Educación aprobó por unanimidad el informe para primer debate del proyecto de Ley que busca institucionalizar el Festival Internacional de Artes Vivas en Loja. El proyecto lo impulsa @veronicaariasf 
677;1067561525265616897;https://twitter.com/GoberLoja/status/1067561525265616897;GoberLoja;;2018-11-27 23:31:16+00:00;78;67;@eleduja;;;Gobernador @eleduja, interviene en la comisión de Educación de la Asamblea Nacional acerca del debate del proyecto de Ley de la Institucionalidad del Festival de Artes Vivas de Loja. 
678;1067540844276826117;https://twitter.com/EducacionAN/status/1067540844276826117;EducacionAN;;2018-11-27 22:09:05+00:00;2;2;;;; VIVO Continuación Sesión No. 042-CECCYT-2018 ORDEN DEL DÍA Dentro del tratamiento del Proyecto de Ley de Institucionalización del Festival Internacional de Artes Vivas Loja, de conformidad con lo previsto en el... https://www.facebook.com/CECCYT/videos/566196680472512/
679;1067538975852806145;https://twitter.com/RomuloMinchalaM/status/1067538975852806145;RomuloMinchalaM;;2018-11-27 22:01:40+00:00;6;10;@EducacionAN @veronicaariasf @AsambleaEcuador @CREOEcuador @BloqueCREO21;;;En el Pleno de @EducacionAN celebramos la Sesión No. 042 en donde votaremos por el Informe de Primer Debate del “Proyecto de Ley de Institucionalización del Festival de Artes Vivas de Loja” presentado por @veronicaariasf @AsambleaEcuador @CREOEcuador @BloqueCREO21
680;1067527219902365701;https://twitter.com/silviasalgadoan/status/1067527219902365701;silviasalgadoan;;2018-11-27 21:14:57+00:00;11;17;@EducacionAN;#FIAVL;;AHORA presido @EducacionAN en la sesión No 042 en la que tratamos el Informe para Primer Debate del Proyecto de Ley de Institucionalización del Festival Internacional de Artes Vivas de Loja #FIAVL
681;1067526035078557698;https://twitter.com/EducacionAN/status/1067526035078557698;EducacionAN;;2018-11-27 21:10:15+00:00;2;2;@Cultura_Ec @veronicaariasf @Rubn_Bustamante;#FIAVL;;Damos inicio a la sesión No 042 en la que tratamos y votaremos el Informe para Primer Debate del Proyecto de Ley de Institucionalización del Festival Internacional de Artes Vivas de Loja #FIAVL Recibimos a @Cultura_Ec y a asambleístas por Loja @veronicaariasf y @Rubn_Bustamante
682;1067525158045474816;https://twitter.com/dallyanapass/status/1067525158045474816;dallyanapass;;2018-11-27 21:06:45+00:00;4;8;@EducacionAN;;;En este instante, @EducacionAN analiza el Proyecto de Ley de Institucionalización del Festival Internacional de Artes Vivas Loja. 
683;1067522547934216193;https://twitter.com/EducacionAN/status/1067522547934216193;EducacionAN;;2018-11-27 20:56:23+00:00;4;8;;;; VIVO Sesión No. 042-CECCYT-2018 ORDEN DEL DÍA Dentro del tratamiento del Proyecto de Ley de Institucionalización del Festival Internacional de Artes Vivas Loja, de conformidad con lo previsto en el artículo 58 de la... https://www.facebook.com/CECCYT/videos/193951308208069/
684;1067511986831990785;https://twitter.com/eerssaoficial/status/1067511986831990785;eerssaoficial;;2018-11-27 20:14:25+00:00;6;5;@RecNaturalesEC @CarlosPerez_MH @Mauro_Intriago_;#EERSSA #EERSSA #Loja #Energ;;[ Labor de la #EERSSA ] Una vez concluido el Festival Internacional de las Artes Vivas, personal de #EERSSA procedió a realizar actividades para normalizar el servicio de energía en el centro de #Loja. #EnergíaSustentable @RecNaturalesEC @CarlosPerez_MH @Mauro_Intriago_
685;1067209809043312651;https://twitter.com/plustv25/status/1067209809043312651;plustv25;;2018-11-27 00:13:40+00:00;3;5;@AnitaJativaSoto @ojeda_mariu @FestivalDeLoja @festivaloffloja @alejofierromo @dvpiedra;#Emisi #PlusNoticias;;Cae el telón del Tercer Festival de Artes Vivas Loja 2018. Autoridades y ciudadanía habla de la realización del mismo. En la #EmisiónEstelar de #PlusNoticias @AnitaJativaSoto @ojeda_mariu @FestivalDeLoja @festivaloffloja @alejofierromo @ma_rociocoronel @dvpiedra
686;1067206348411191298;https://twitter.com/Rubn_Bustamante/status/1067206348411191298;Rubn_Bustamante;;2018-11-26 23:59:55+00:00;15;18;;#Loja #Loja #LojaDefiendeSuFestival;;INVITACIÓN Invitamos a la ciudadanía de #Loja a ser partícipes de la video conferencia que tendremos en la @CANLoja donde trataremos la Institucionalización del Festival Internacional de Artes Vivas. Para #Loja es de mucha importancia su participación. #LojaDefiendeSuFestival
687;1067062498120089600;https://twitter.com/VistoLoja/status/1067062498120089600;VistoLoja;;2018-11-26 14:28:19+00:00;16;26;;#Loja;;¡Loja se vistió de fiesta en las Artes Vivas! #Loja | Por tercer año consecutivo, Loja fue sede del Festival Internacional de Artes Vivas, que se cumplió del 15 al 25 de noviembre. Aquí les compartimos lo que nos dejó este magno evento cultural. 
688;1067054551210041344;https://twitter.com/BlacioRobert/status/1067054551210041344;BlacioRobert;;2018-11-26 13:56:44+00:00;26;16;;#IntendenciaLoja #SeguridadCiudadana;;El III Festival Internacional de Artes Vivas Loja, se convirtió nuevamente en un referente de las artes escénicas a nivel nacional e internacional. Gracias a todos los Comisarios de la Provincia e #IntendenciaLoja, por su compromiso diario de precautelar la #SeguridadCiudadana.
689;1067041330520571904;https://twitter.com/ecuadormycountr/status/1067041330520571904;ecuadormycountr;;2018-11-26 13:04:12+00:00;1;0;;#Loja #turistas #viajeros #expats;;"Concluye en Ecuador III Festival de Artes Vivas de #Loja #turistas #viajeros #expats https://www.prensa-latina.cu/index.php?o=rn&amp;id=231539&amp;SEO=concluye-en-ecuador-iii-festival-de-artes-vivas-de-loja"
690;1067014323430727687;https://twitter.com/bolivar_lojan/status/1067014323430727687;bolivar_lojan;;2018-11-26 11:16:53+00:00;0;7;@Jeanninecruzz @nmcresearch @75Ruilova @KarlosAndradet @leninpaladiness @lindonsanmartin @CristobalMocha @MAMELOSILVAL @PaveValdivieso @NiveaVelez @PabloXBurneo @freddy_aponte;;;"Yo también hice mi ""alguito"" en el Festival Internacional de Artes Vivas de Loja @Jeanninecruzz @nmcresearch @75Ruilova @KarlosAndradet @leninpaladiness @lindonsanmartin @CristobalMocha @MAMELOSILVAL @PaveValdivieso @NiveaVelez @PabloXBurneo @wilmannoticias @freddy_aponte"
691;1066916488429400064;https://twitter.com/MunicipioDeLoja/status/1066916488429400064;MunicipioDeLoja;;2018-11-26 04:48:07+00:00;10;24;;#FIAVL2018;;#FIAVL2018 | En el teatro Benjamín Carrión se clausuró oficialmente la III edición del Festival Internacional de Artes Vivas. Viceministro Gabriel Cisneros señaló que el festival del 2019 será en Loja, y esto ha sido ratificado por el Ministro de Cultura Raúl Pérez Torres. 
692;1066901916356157443;https://twitter.com/VistoLoja/status/1066901916356157443;VistoLoja;;2018-11-26 03:50:13+00:00;11;8;@ghidalgoandrade;#Loja;;¡Capital del Arte! #Loja | El Festival de las Artes Vivas debe continuar en Loja. Artículo: @ghidalgoandrade
693;1066873467386122240;https://twitter.com/FestivalDeLoja/status/1066873467386122240;FestivalDeLoja;;2018-11-26 01:57:10+00:00;4;10;@gabrielcisne @Cultura_Ec;#FIAVL2018 #ElArteViveEnLoja;;. @gabrielcisne finaliza su intervención en la noche de clausura garantizando que el Festival Internacional de Artes Vivas de 2019 se realizará en Loja. #FIAVL2018 #ElArteViveEnLoja @Cultura_Ec
694;1066870129894596608;https://twitter.com/nopiedra/status/1066870129894596608;nopiedra;;2018-11-26 01:43:55+00:00;1;0;;#fiavl2018 #Loja #FIAVL2019;;"En la clausura del #fiavl2018, y a prepararnos para el 4to Festival Internacional de Artes Vivas #Loja 2019. #FIAVL2019 en Teatro Benjamín Carrión Mora de Loja https://www.instagram.com/p/BqoCN6Ug-2a/?utm_source=ig_twitter_share&amp;igshid=zt072k23l78l"
695;1066859301656907776;https://twitter.com/TeatroBenjaminC/status/1066859301656907776;TeatroBenjaminC;;2018-11-26 01:00:53+00:00;0;1;@TeatroBenjaminC;#FIAVL2018 #ElArteViveEnLoja;;"CLAUSURA | #FIAVL2018 En pocos minutos se dará inicio a la clausura del Festival Internacional de Artes Vivas Loja 2018, en el @TeatroBenjaminC con la obra ""El enemigo del pueblo"", de la Compañía de Teatro de México #ElArteViveEnLoja"
