;ID;ENLACE;USUARIO;@CUENTA;FECHA;RETWEETS;FAVORITO;MENCIONA;HASHTAGS;GEO;TEXTO
1264;1038457597681197056;https://twitter.com/VeronicaPinzonD/status/1038457597681197056;VeronicaPinzonD;;2018-09-08 16:02:39+00:00;0;1;@Rosymar_GA;#OjalaEstuvierasAqui #Loja #Noviembre;;"Feliz de volver a producir esta obra #OjalaEstuvierasAqui de @Ignasividalofi estaremos en el Festival Internacional de Artes vivas de #Loja en #Noviembre salvaje_ec Con @Rosymar_GA y… https://www.instagram.com/p/BneJsFjDyFo/?utm_source=ig_twitter_share&amp;igshid=1b00ju0esptz7"
1265;1038214258461429761;https://twitter.com/clapolanco/status/1038214258461429761;clapolanco;;2018-09-07 23:55:42+00:00;0;0;@Cultura_Ec @FestivalDeLoja;#Ecuador #Colombia #EFE;;Autoridades de #Ecuador @Cultura_Ec promoverán en #Colombia el Festival Internacional de Artes Vivas Loja 2018 @FestivalDeLoja. Nota de #EFE en el diario El Comercio: https://bit.ly/2wTsOAQ
1266;1038099478937579520;https://twitter.com/FestivalDeLoja/status/1038099478937579520;FestivalDeLoja;Cultura_Ec;2018-09-07 16:19:37+00:00;3;5;@Cultura_Ec;#FIAVL2018 #CulturaenTerritorio;;Culminó la rueda de prensa en la cual se dio a conocer la programación del #FIAVL2018. El Festival Internacional de Artes Vivas Loja 2018 se realizará del 15 al 25 de noviembre del 2018. Conoce más en: http://festivaldeloja.com #CulturaenTerritorio @Cultura_Ec
1267;1038094393037733888;https://twitter.com/INPCEcuador/status/1038094393037733888;INPCEcuador;;2018-09-07 15:59:24+00:00;1;2;@RaPerezTorresEc;#Loja;;Rueda de prensa| Ministro @RaPerezTorresEc realiza el lanzamiento oficial del Tercer Festival de Artes Vivas en #Loja donde se disfrutarán de las expresiones artísticas y patrimoniales del Ecuador y el mundo. 
1268;1038092101936926721;https://twitter.com/FestivalDeLoja/status/1038092101936926721;FestivalDeLoja;;2018-09-07 15:50:18+00:00;10;9;@Cultura_Ec;#FIAVL2018 #CulturaEnTerritorio;;El Director Artístico del #FIAVL2018, Roberto Sánchez, presenta al público la programación nacional e internacional del Festival Internacional de Artes Vivas Loja 2018. Conoce a detalle las obras en http://www.festivaldeloja.com #CulturaEnTerritorio @Cultura_Ec
1269;1038089466974535681;https://twitter.com/SiguemeLoja/status/1038089466974535681;SiguemeLoja;;2018-09-07 15:39:50+00:00;0;1;;#Loja #FIAVL2018 #LojaEsCultura;;#Loja | En el Teatro Benjamín Carrión se realiza la presentación de la programación del III Festival de Artes Vivas Loja 2018 #FIAVL2018. #LojaEsCultura
1270;1038086133178093569;https://twitter.com/GoberLoja/status/1038086133178093569;GoberLoja;;2018-09-07 15:26:35+00:00;89;50;@eleduja @Cultura_Ec;#FIAVL2018 #Loja;;#FIAVL2018 | Arranca Lanzamiento del 3r. Festival de Artes Vivas #Loja 2018. Gobernador @eleduja acompaña a Ministro @Cultura_Ec en este evento. 
1271;1038085923400032256;https://twitter.com/primereporte/status/1038085923400032256;primereporte;;2018-09-07 15:25:45+00:00;3;2;;#FIAVL2018;;¡El arte vive en Loja! En este momento se realiza el lanzamiento del Festival de Artes Vivas Loja 2018. #FIAVL2018.
1272;1038084866276028416;https://twitter.com/Cultura_Ec/status/1038084866276028416;Cultura_Ec;;2018-09-07 15:21:33+00:00;4;5;@eleduja @GoberLoja;#FIAVL2018 #CulturaEnTerritorio;;.@eleduja, @GoberLoja, da la bienvenida a todos quienes hacen el Festival Internacional de Artes Vivas que se desarrolla en Loja. #FIAVL2018 #CulturaEnTerritorio
1273;1038082491209400320;https://twitter.com/FestivalDeLoja/status/1038082491209400320;FestivalDeLoja;;2018-09-07 15:12:07+00:00;6;10;@RaPerezTorresEc @Cultura_Ec;#FIAVL2018 #Loja #CulturaEnTerritorio;;Inicia el Lanzamiento del Festival de Artes Vivas Loja 2018, #FIAVL2018, en la ciudad de #Loja. Este evento cuenta con la presencia de @RaPerezTorresEc, Ministro de @Cultura_Ec. #CulturaEnTerritorio
1274;1037890246262906880;https://twitter.com/BruceGaravito/status/1037890246262906880;BruceGaravito;;2018-09-07 02:28:12+00:00;0;0;@FestivalDeLoja @technocio;#FIAVL2018;;El Festival Internacional de Artes Vivas Loja 2018 afianza los lazos interculturales en la región #FIAVL2018 @FestivalDeLoja https://technocio.com/el-festival-internacional-de-artes-vivas-loja-2018-afianza-los-lazos-interculturales-en-la-region/ vía @technocio
1275;1037889916280209408;https://twitter.com/technocio/status/1037889916280209408;technocio;;2018-09-07 02:26:53+00:00;0;0;;;;El Festival Internacional de Artes Vivas Loja 2018 afianza los lazos interculturales en la región https://technocio.com/el-festival-internacional-de-artes-vivas-loja-2018-afianza-los-lazos-interculturales-en-la-region/
1276;1037358483602108416;https://twitter.com/Cultura_Ec/status/1037358483602108416;Cultura_Ec;;2018-09-05 15:15:10+00:00;5;4;@ecuniversitario;#FIAVL2018 #CulturaEnTerritorio;;NOTICIA Programación Oficial del Festival Internacional de Artes Vivas 2018 se presenta el viernes en Loja. http://bit.ly/2LWyRKo vía @ecuniversitario #FIAVL2018 #CulturaEnTerritorio
1277;1037125895084036096;https://twitter.com/MunicipioDeLoja/status/1037125895084036096;MunicipioDeLoja;;2018-09-04 23:50:56+00:00;3;3;;#Loja #MunicipioDeLoja;;#Loja #MunicipioDeLoja | Se anticipa grandes sorpresas en la III edición del Festival Internacional de Artes Vivas. Se ubicará cerca de diez escenarios con mobiliario urbano referente a temas teatrales. https://goo.gl/wDpk6h
1278;1035176945208709120;https://twitter.com/DanzaRojo/status/1035176945208709120;DanzaRojo;;2018-08-30 14:46:31+00:00;0;1;;;;CAMINO ROJO DANZA TEATRO, Estará en el Festival Internacional de Artes Vivas de Loja. Noviembre 2018 
1279;1034974763448455168;https://twitter.com/NicolasCeli3/status/1034974763448455168;NicolasCeli3;LuisitoComunica;2018-08-30 01:23:07+00:00;0;0;;;;Ven a Ecuador en Noviembre a una ciudad llamada Loja donde todos los años se realiza un festival de artes vivas internacional, de verdad es arte en todas sus expresiones por todas las calles que se vuelven peatonales, y es que Si usted nunca ha ido a Loja, no conoce a mi país 
1280;1033274950487027712;https://twitter.com/NicolasCeli3/status/1033274950487027712;NicolasCeli3;JuanBertheau;2018-08-25 08:48:40+00:00;0;1;;;;Pues ven a ecuador en noviembre a una ciudad llamada Loja donde se desarrolla un festival de artes vivas internacional en ese mes, no se van arrepentir ni tu ni luisito
1281;1033181441897771009;https://twitter.com/NicolasCeli3/status/1033181441897771009;NicolasCeli3;LuisitoComunica;2018-08-25 02:37:05+00:00;0;1;;;;Pues ven a ecuador en noviembre a una ciudad llamada Loja donde se desarrolla un festival de artes vivas internacional en ese mes, no te vas arrepentir perroo
1282;1032265654806736898;https://twitter.com/francisludena/status/1032265654806736898;francisludena;;2018-08-22 13:58:05+00:00;0;0;;#Loja;;Y por último como vas a decir Jesús bendito, que un festival de las artes vivas que se vivirá en una ciudad fronteriza como #Loja se verá reflejado en gentes con tiza en mano pintarrajeando calles recién asfaltadas de la urbe!!! Cuanta ignorancia anda por ahí suelta XD
1283;1029479173742637056;https://twitter.com/ChicaCultura/status/1029479173742637056;ChicaCultura;;2018-08-14 21:25:36+00:00;5;6;@Expresoec;;;El Festival Internacional de Artes Vivas de Loja pasó de costar menos de dos millones a seis millones. Esa y otras irregularidades fueron analizadas por la Contraloría. Mi nota de hoy en @Expresoec https://bit.ly/2w6Y66H
1284;1029116965900759042;https://twitter.com/miregionec/status/1029116965900759042;miregionec;;2018-08-13 21:26:19+00:00;2;0;;#Loja;;#Loja: Casa de la Cultura de Loja piensa que falta unión de los artistas lojanos en el Festival de Artes Vivas. El director de la Casa de la Cultura, Diego Naranjo Hidalgo, explica que han realizado aportes referente al desarrollo del Festival Internacional de Artes Vivas. 
1285;1027528313580003328;https://twitter.com/radiohcjb/status/1027528313580003328;radiohcjb;;2018-08-09 12:13:35+00:00;4;4;@Cultura_Ec;#D;;#DíaDeLaCultura| Este ha sido declarado el año de los museos y mes a mes se están activando estos repositorios, se está activando el Plan Nacional de la Lectura y se ha instituido el Festival de Artes vivas en Loja: Isabel Rhon, viceministra de Patrimonio de @Cultura_Ec
1286;1027236032566243329;https://twitter.com/aoleasp/status/1027236032566243329;aoleasp;PabloVillalta1;2018-08-08 16:52:09+00:00;1;0;;;;En ese sentido, ni el festival de luces de Quito, ni el festival de artes vivas de Loja cumplen con tu idea. Son festivales específicos que apuntan a segmentos definidos (sobre todo el de Loja). El arte y la cultura mutan y evolucionan, es imposible ser tan generalista.
1287;1023171377505947648;https://twitter.com/soy593/status/1023171377505947648;soy593;;2018-07-28 11:40:40+00:00;0;0;;#Gamavisi;;En Noviembre se vivirá el Festival Internacional de Loja Artes Vivas 2018. #GamavisiónNoticias. https://buff.ly/2LR8rKQ
1288;1022999031860158464;https://twitter.com/MunicipioDeLoja/status/1022999031860158464;MunicipioDeLoja;;2018-07-28 00:15:50+00:00;3;4;;#Loja #MunicipioDeLoja;;#Loja #MunicipioDeLoja | Con motivo de la tercera edición del III Festival Internacional de Artes Vivas Loja 2018, el ayuntamiento local a través de la jefatura del centro histórico, empezará a pintar llamativas obras en el centro de la ciudad. 
1289;1022610082712965121;https://twitter.com/Gamanoticiasec/status/1022610082712965121;Gamanoticiasec;;2018-07-26 22:30:17+00:00;0;1;;#Gamavisi;;En Noviembre se vivirá el Festival Internacional de Loja Artes Vivas 2018. #GamavisiónNoticias. https://buff.ly/2LR8rKQ
1290;1020429312065929218;https://twitter.com/MunicipioDeLoja/status/1020429312065929218;MunicipioDeLoja;;2018-07-20 22:04:41+00:00;3;6;;#Loja #MunicipioDeLoja;;#Loja #MunicipioDeLoja | En Loja varias personas realizan emprendimientos realizados en madera como fachadas y alcancías, estos detalles son manufacturas elaboradas por cada emprendedor, todo esto con miras al III Festival Internacional de Artes Vivas. 
1291;1020007703056351235;https://twitter.com/MunicipioDeLoja/status/1020007703056351235;MunicipioDeLoja;;2018-07-19 18:09:21+00:00;4;4;;#Loja #MunicipioDeLoja;;#Loja #MunicipioDeLoja | Los dirigentes de las cooperativas de taxis ejecutivos visitaron a la alcaldesa del cantón y ofrecieron el respaldo necesario para promover las actividades del Festival de Artes Vivas que se realizará en noviembre de este año. 
1292;1019967602645446663;https://twitter.com/ElCiudadano_ec/status/1019967602645446663;ElCiudadano_ec;;2018-07-19 15:30:01+00:00;1;1;;;;Se presentó programación oficial del Festival Internacional de Artes Vivas de Loja 2018. Entérese más en http://bit.ly/2mv8TTK
1293;1019609969073762304;https://twitter.com/Educacion_Ec/status/1019609969073762304;Educacion_Ec;;2018-07-18 15:48:54+00:00;13;6;@Educacion_Ec @Cultura_Ec @UNESCOQuito;;;Jurado experto en danza, música y artes plásticas de @Educacion_Ec , @Cultura_Ec y @UNESCOQuito, seleccionan las obras que serán finalistas de la segunda edición de “Jóvenes, arte en acción”. Los ganadores se presentarán en el Festival Internacional de Artes Vivas de Loja. 
1294;1019590289923739648;https://twitter.com/MasharosNews/status/1019590289923739648;MasharosNews;;2018-07-18 14:30:42+00:00;1;2;;#Loja #FIAVL;;Artistas de diez países participarán en la tercera edición del Festival Internacional de Artes Vivas #Loja 2018 (#FIAVL), que se desarrollará del 15 al 25 de noviembre, informó el 17/07/2018, el ministro de Cultura y Patrimonio, Raúl Pérez Torres. https://www.facebook.com/masharosnews/posts/2115384868709444
1295;1019574423484067841;https://twitter.com/gustavo_oso/status/1019574423484067841;gustavo_oso;;2018-07-18 13:27:39+00:00;0;0;;;;Éstas son algunas de las delegaciones artísticas que llegarán a Loja en este 2018 para el FESTIVAL INTERNACIONAL DE ARTES VIVAS. https://www.facebook.com/532700711/posts/10156706888565712/
1296;1019338935611412481;https://twitter.com/InfoNodal/status/1019338935611412481;InfoNodal;;2018-07-17 21:51:55+00:00;0;3;@Nodalcultura @FestivalDeLoja;#FIAVL2018;;Se presentó programación oficial de la tercera edición del Festival Internacional de Artes Vivas de Loja 2018. +INFO en @nodalcultura @FestivalDeLoja #FIAVL2018
1297;1019283750956535809;https://twitter.com/UnidosPorLoja/status/1019283750956535809;UnidosPorLoja;;2018-07-17 18:12:38+00:00;1;2;@SantiagoCarpioR;#Loja;;Qué se viene para el Festival Off de Artes Vivas ? #Loja | @SantiagoCarpioR, Director del Festival Off nos cuenta más detalles de lo que se vivirá en nuestra ciudad a vísperas del festival en noviembre. 
1298;1019266891498577921;https://twitter.com/MunicipioDeLoja/status/1019266891498577921;MunicipioDeLoja;;2018-07-17 17:05:38+00:00;10;16;;;;En el Centro Cultural Municipal Bernardo Valdivieso, el Municipio de Loja cumplió con la socialización del Festival Off, evento que es parte del III Festival Internacional de Artes Vivas “Loja 2018”, a desarrollarse en noviembre próximo. Más: https://goo.gl/HMnojB
1299;1019262445624360961;https://twitter.com/CronicaLoja/status/1019262445624360961;CronicaLoja;;2018-07-17 16:47:58+00:00;1;0;;#Loja #FIAVL2018 #FIAVL;;En la Casona Municipal #Loja se realizó la presentación del III Festival Off que se cumplirá del 15 al 25 de noviembre #FIAVL2018 #FIAVL Festival Internacional de Artes Vivas Loja 
1300;1019253538961149952;https://twitter.com/VistoLoja/status/1019253538961149952;VistoLoja;;2018-07-17 16:12:35+00:00;8;7;@MunicipioDeLoja;#Loja;;¡Festival Off! #Loja | El @MunicipioDeLoja realizó la socialización del Festival Off, evento que es parte del Festival Internacional de Artes Vivas. Agrupaciones culturales de Francia, Alemania, España y otras, estarán presentes en noviembre. https://www.facebook.com/VistoLoja/videos/1992454340773829/
1301;1019248263407505409;https://twitter.com/andesecuador/status/1019248263407505409;andesecuador;;2018-07-17 15:51:37+00:00;0;1;;#Ecuador;;"#Ecuador &gt; Autoridades ofrecen detalles de los elencos que se presentaran en la III Edición del Festival Internacional de Artes Vivas de Loja (sur) "
1302;1019247677471588352;https://twitter.com/lodelmomentoloj/status/1019247677471588352;lodelmomentoloj;;2018-07-17 15:49:17+00:00;1;2;;#Loja #Edici #FIAVLoja2018;;#Loja | Lanzamiento de #EdiciónOFF del #FIAVLoja2018. Desde la Casona del Teatro Bolívar, se realizó el lanzamiento de la edición OFF del Festival Internacional del Artes Vivas Loja 2018 Leer más en: https://bit.ly/2NU1tpH
1303;1019246760877875201;https://twitter.com/rafaelahermida/status/1019246760877875201;rafaelahermida;;2018-07-17 15:45:39+00:00;0;0;@minculturaec;#FIAVL2018;;@minculturaec participa en el lanzamiento oficial del Festival de Artes Vivas Loja 2018. Busca impulsar el talento ecuatoriano a escala internacional #FIAVL2018
1304;1019245612955467776;https://twitter.com/calu/status/1019245612955467776;calu;FestivalDeLoja;2018-07-17 15:41:05+00:00;3;2;;#FIAVL2018 #WTF;;¿La rueda de prensa y lanzamiento del Festival Internacional de Artes Vivas de LOJA #FIAVL2018 se presenta... en Quito? #WTF
1305;1018940094076645376;https://twitter.com/gustavo_oso/status/1018940094076645376;gustavo_oso;;2018-07-16 19:27:04+00:00;0;1;;#ElArteViveEnLoja;;"Empecemos a darle la bienvenida el III FESTIVAL INTERNACIONAL DE ARTES VIVAS, seamos parte de FESTIVAL OFF #ElArteViveEnLoja en Loja, Ecuador https://www.instagram.com/p/BlTeKg8HHAN/?utm_source=ig_twitter_share&amp;igshid=go1bqllfsl3v"
1306;1017767318456295424;https://twitter.com/MasharosNews/status/1017767318456295424;MasharosNews;;2018-07-13 13:46:52+00:00;1;1;;;;Fueron 227 las postulaciones de artistas a nivel nacional que se presentaron para la tercera edición del Festival Internacional de Artes Vivas, que se realizará del 15 al 25 de noviembre de 2018 en la ciudad de Loja. https://www.facebook.com/masharosnews/posts/2110432645871333
1307;1016865980583174144;https://twitter.com/imagodani/status/1016865980583174144;imagodani;;2018-07-11 02:05:16+00:00;2;1;;;;"Imago Teatro de Quito estrenará ""Variaciones para el tema del asesino"" en la tercera edición del Festival Internacional de Artes Vivas de Loja 2018. https://www.festivaldeloja.com/noticias/el-cartel-de-grupos-nacionales-lo-integran-16-obras-seleccionadas/"
1308;1016063170379702277;https://twitter.com/en_Ecuador/status/1016063170379702277;en_Ecuador;;2018-07-08 20:55:12+00:00;2;0;@CINEenEcuador;#Loja;;El Festival Internacional de Artes Vivas de Loja 2018 convoca a artistas para su tercera versión (#Loja @CINEenEcuador): http://www.elciudadano.gob.ec/el-festival-de-artes-vivas-de-loja-abre-convocatoria-para-franja-de-teatro-juvenil/
1309;1015264575854448640;https://twitter.com/PublicaFM/status/1015264575854448640;PublicaFM;;2018-07-06 16:01:52+00:00;0;1;@SantyTello;;;El Gobernador de la Provincia de Loja Eduardo Jaramillo, anuncia que el Festival de las Artes Vivas de Loja que se desarrollará en noviembre próximo, contará con más de 1.500 actores en escena. Vía @SantyTello
1310;1014297741915123712;https://twitter.com/FestivalDeLoja/status/1014297741915123712;FestivalDeLoja;;2018-07-04 00:00:01+00:00;78;80;@Cultura_Ec;#FIAVL2018;;Loja se convierte en un escenario vivo durante el #FIAVL2018. El Festival es el proyecto del Ministerio de Cultura y Patrimonio, @Cultura_ec, para impulsar el desarrollo de las artes vivas en Loja y en todo el país. Conoce más en: http://goo.gl/NNm1cb
1311;1014202128963907585;https://twitter.com/lahoraecuador/status/1014202128963907585;lahoraecuador;;2018-07-03 17:40:05+00:00;0;3;;#Ecuador;;La música y las bellas artes tienen una cita en el sur de #Ecuador España, Japón e Italia confirman su participación Festival Internacional de Artes Vivas Loja 2018 en noviembre próximo▼ 
1312;1013769044980322305;https://twitter.com/radioluzyvidaec/status/1013769044980322305;radioluzyvidaec;;2018-07-02 12:59:09+00:00;4;1;@maomorenolara;#Loja;;En Notiradio I Emisión @maomorenolara director de Cultura señala detalles del Tercer Festival de Artes Vivas #Loja a desarrollarse en noviembre, con un presupuesto de $2,900 000 
1313;1012878390657986561;https://twitter.com/FestivalDeLoja/status/1012878390657986561;FestivalDeLoja;;2018-06-30 02:00:01+00:00;19;29;@Cultura_Ec;#FIAVL2018;;Más de 1.500 artistas recibieron ovaciones de pie de los 500 mil asistentes que disfrutaron del Festival Internacional de Artes VIvas Loja 2017. @Cultura_ec Este noviembre ven y contágiate de arte en el #FIAVL2018. Conoce más en: http://www.festivaldeloja.com
1314;1010738049301516288;https://twitter.com/RosarioCordovaV/status/1010738049301516288;RosarioCordovaV;;2018-06-24 04:15:04+00:00;2;5;@MashiRafael;#Loja;;El Festival de las Artes Vivas que fue decretado para #Loja por el expresidente @MashiRafael (buen amigo y defensor del Chato), es una intervención en la cual el rol del Municipio es fundamental a pesar de que los recursos son estatales. 
1315;1007611896835575808;https://twitter.com/Cultura_Ec/status/1007611896835575808;Cultura_Ec;;2018-06-15 13:12:51+00:00;4;5;;;;Hoy es el último día de la convocatoria para que artistas nacionales participen en el Festival Internacional de Artes Vivas de Loja 2018. ¡No te quedes fuera! Conoce más en: http://bit.ly/2rkJkXO
1316;1007353632197574657;https://twitter.com/Cultura_Ec/status/1007353632197574657;Cultura_Ec;;2018-06-14 20:06:36+00:00;1;2;;;;Hasta mañana estará abierta la convocatoria para que artistas nacionales participen en el Festival Internacional de Artes Vivas de Loja 2018. ¡No te quedes fuera! Conoce más en http://bit.ly/2rkJkXO
1317;1006202442327969793;https://twitter.com/Cultura_Ec/status/1006202442327969793;Cultura_Ec;;2018-06-11 15:52:11+00:00;3;1;;#ElArteViveEnLoja;;Recuerda que hasta el 15 de junio está abierta la convocatoria para que artistas nacionales participen en el Festival Internacional de Artes Vivas de Loja 2018. Conoce más en http://bit.ly/2rkJkXO #ElArteViveEnLoja
1318;1003093913966538752;https://twitter.com/FestivalDeLoja/status/1003093913966538752;FestivalDeLoja;;2018-06-03 02:00:00+00:00;17;24;@Cultura_Ec;#FIAVL2018;;La segunda edición del Festival Internacional de Artes Vivas Loja convocó a más de 500 mil asistentes. ¡Este año seremos más! Sé parte del #FIAVL2018. @Cultura_ec Conoce más en: http://www.festivaldeloja.com
1319;999701796967927809;https://twitter.com/Gamanoticiasec/status/999701796967927809;Gamanoticiasec;;2018-05-24 17:20:56+00:00;0;0;@Lenin;#ElPrimerA;;"#ElPrimerAñoDeTodos | @Lenin: ""En nuestra gestión cultural recuerdo que el Festival de Artes Vivas en Loja reunió a 550.000 personas""."
1320;999700621950443521;https://twitter.com/RecNaturalesEC/status/999700621950443521;RecNaturalesEC;;2018-05-24 17:16:16+00:00;4;1;@Lenin;#ElPrimerA;;".@Lenin: ""En nuestra gestión cultural recuerdo que el Festival de Artes Vivas en Loja reunió a 550.000 personas"" #ElPrimerAñoDeTodos"
1321;998590418433593344;https://twitter.com/cculturaloja/status/998590418433593344;cculturaloja;;2018-05-21 15:44:43+00:00;1;4;;;;El mensaje de carta abierta al Dir. del Festival Internacional de Artes Vivas Loja fue elaborada por un consenso de los miembros del directorio de la CCE-LOJA, con el propósito de elevar un compromiso institucional de participar en este magno evento de las artes 
1322;997186473395924992;https://twitter.com/JacksonT_C/status/997186473395924992;JacksonT_C;;2018-05-17 18:45:56+00:00;10;9;;#FestivalOff2018 #Loja;;Convocatoria para participar en el III Festival Off #FestivalOff2018 #Loja Rumbo al Festival Internacional de Artes Vivas 2018. Mas información http://www.loja.gob.ec
1323;997183867646894081;https://twitter.com/MunicipioDeLoja/status/997183867646894081;MunicipioDeLoja;;2018-05-17 18:35:35+00:00;12;23;;;;En rueda de prensa se oficializó la convocatoria al III Festival Internacional de Artes Vivas Loja 2018 OFF. La convocatoria inicia desde este 17 de mayo al 17 de junio. Ingresa: http://www.loja.gob.ec/festival/
1324;996510542377431040;https://twitter.com/FestivalDeLoja/status/996510542377431040;FestivalDeLoja;;2018-05-15 22:00:02+00:00;24;57;@Cultura_Ec;#FIAVL2018 #ConvocatoriaAbierta;;¿Quieres ser parte del Festival Internacional de Artes Vivas Loja 2018? Lo mejor de las artes vivas en el #FIAVL2018 ¡Postula ya! Conoce las bases y aplica aquí: http://goo.gl/AXsBKs #ConvocatoriaAbierta @Cultura_Ec
1325;996195002945560576;https://twitter.com/chatojobol/status/996195002945560576;chatojobol;;2018-05-15 01:06:11+00:00;97;152;;;;Todos los pueblos, todas las artes en el III Festival Internacional de Artes Vivas Loja 2018. 
1326;994903005391720449;https://twitter.com/ConectadosLoja/status/994903005391720449;ConectadosLoja;;2018-05-11 11:32:15+00:00;1;1;@FestivalDeLoja;#ElArteViveEnLoja #FIAVL2018 #Loja #Ecuador;;¿Tienes un proyecto de artes vivas inédito? ¡Postula para hacerlo realidad y estrenarlo en el Festival Internacional de Artes Vivas Loja 2018! Conoce las bases y aplica aquí http://goo.gl/AXsBKs #ElArteViveEnLoja #FIAVL2018 @FestivalDeLoja #Loja #Ecuador
1327;994230513752653824;https://twitter.com/FestivalDeLoja/status/994230513752653824;FestivalDeLoja;;2018-05-09 15:00:01+00:00;9;4;@Cultura_Ec;#ElArteViveEnLoja #FIAVL2018;;¿Tienes un proyecto de artes vivas inédito? ¡Postula para hacerlo realidad y estrenarlo en el Festival Internacional de Artes Vivas Loja 2018! @Cultura_Ec Conoce las bases y aplica aquí http://goo.gl/AXsBKs #ElArteViveEnLoja #FIAVL2018
1328;993958807788277760;https://twitter.com/CasadelaCultura/status/993958807788277760;CasadelaCultura;;2018-05-08 21:00:21+00:00;2;2;@cculturaloja;#CCEN #Loja;;#CCENÚCLEOS l #Loja se acerca el FIAVL Si eres un artista, grupo nacional o extranjero esta convocatoria es para ti, la @cculturaloja te invita a participar en el Festival Internacional de Artes Vivas Loja 2018. Más inf: http://bit.ly/2rs9F6a
1329;993593960693104640;https://twitter.com/cculturaloja/status/993593960693104640;cculturaloja;;2018-05-07 20:50:34+00:00;2;5;;;;La Casa de la Cultura Ecuatoriana Benjamín Carrión Núcleo de Loja te invita a conocer más sobre las bases de la convocatoria a artistas nacionales para participar en el Festival Internacional de Artes Vivas Loja aquí https://bit.ly/2HXmP6q
1330;993484655339941888;https://twitter.com/RadioBaracoa/status/993484655339941888;RadioBaracoa;;2018-05-07 13:36:14+00:00;0;0;;;;"Abierta en Ecuador convocatoria para Festival de Artes Vivas de Loja http://prensa-latina.cu/index.php?o=rn&amp;id=176481&amp;SEO=abierta-en-ecuador-convocatoria-para-festival-de-artes-vivas-de-loja"
1331;992564686875836422;https://twitter.com/MunicipioDeLoja/status/992564686875836422;MunicipioDeLoja;;2018-05-05 00:40:36+00:00;3;4;;;;Municipio de Loja ha iniciado con la preparación del Festival de Artes Vivas en su III Edición: http://youtu.be/U1XA6i6aSyo?a vía
1332;991815803979878400;https://twitter.com/MunicipioDeLoja/status/991815803979878400;MunicipioDeLoja;;2018-05-02 23:04:49+00:00;18;22;;#Loja #MunicipioDeLoja;;#Loja #MunicipioDeLoja | Y pensar que existen politiqueros que intentaron detener la restauración de esta joya patrimonial, que se ha convertido en uno de los principales escenarios del Festival de Artes Vivas. 
1333;991687881386229760;https://twitter.com/CulturacreaUmh/status/991687881386229760;CulturacreaUmh;;2018-05-02 14:36:30+00:00;0;0;;#Culturaiberoamericana;;El Festival Internacional de Artes Vivas Loja celebrará su tercera edición del 15 al 25 de noviembre en la ciudad ecuatoriana de Loja. #Culturaiberoamericana https://www.festivaldeloja.com/noticias/
1334;990955081184006144;https://twitter.com/elchasqui_18/status/990955081184006144;elchasqui_18;;2018-04-30 14:04:37+00:00;0;0;;;;El Festival de Artes Vivas Loja inicia su convocatoria. Más información en: https://elchasquinformativo.blogspot.com/2018/04/el-festival-de-artes-vivas-loja-inicia.html
