;ID;ENLACE;USUARIO;@CUENTA;FECHA;RETWEETS;FAVORITO;MENCIONA;HASHTAGS;GEO;TEXTO
1981;910287796241420288;https://twitter.com/MunicipioDeLoja/status/910287796241420288;MunicipioDeLoja;;2017-09-19 23:41:37+00:00;21;21;;#Loja;;#Loja | Loja te espera del 13 al 26 de noviembre en el II Festival Internacional de Artes Vivas 2017 ¡Vívelo tú mismo¡ 
1982;909945593849663488;https://twitter.com/FranceEquateur/status/909945593849663488;FranceEquateur;;2017-09-19 01:01:50+00:00;0;2;;#FIAVL2017;;#FIAVL2017 Francia en la 2da edición del Festival de las Artes Vivas de Loja https://twitter.com/festivaldeloja/status/909945158485053440
1983;909135048212754432;https://twitter.com/EcuadorTravel/status/909135048212754432;EcuadorTravel;FestivalDeLoja;2017-09-16 19:21:01+00:00;5;3;;#AllYouNeedIsEcuador;;¡Vive el Festival Intl. de Artes Vivas en Loja! Acércate y disfruta de este evento que está en constante crecimiento. #AllYouNeedIsEcuador
1984;908009111551438849;https://twitter.com/MunicipioDeLoja/status/908009111551438849;MunicipioDeLoja;;2017-09-13 16:46:56+00:00;5;8;;#Loja;;#Loja | 1500 artistas se presentarán en el Segundo Festival Internacional de Artes Vivas. 
1985;906351369807949824;https://twitter.com/rogoarte2/status/906351369807949824;rogoarte2;;2017-09-09 02:59:40+00:00;0;0;;;;"Estoy participando en el Sorteo con Múltiple Choice ""TRIVIA 1"" en 1er Festival Internacional de Artes Vivas Loja 201 https://goo.gl/QU5WH3"
1986;905930213208576001;https://twitter.com/GinaLourdes06/status/905930213208576001;GinaLourdes06;eerssaoficial;2017-09-07 23:06:08+00:00;0;0;;;;Exitos ....en el evento de Artes Vivas.Eerssa presente en Festival de Loja.
1987;905818145012768774;https://twitter.com/kellytashawol/status/905818145012768774;kellytashawol;;2017-09-07 15:40:49+00:00;0;0;;;;"Estoy participando en el Sorteo con Múltiple Choice ""TRIVIA 1"" en 1er Festival Internacional de Artes Vivas Loja 201 https://goo.gl/QU5WH3"
1988;905550869797666816;https://twitter.com/KevinAlverca/status/905550869797666816;KevinAlverca;;2017-09-06 21:58:46+00:00;0;0;;;;"Estoy participando en el Sorteo con Múltiple Choice ""TRIVIA 1"" en 1er Festival Internacional de Artes Vivas Loja 201 https://goo.gl/QU5WH3"
1989;905456170613268482;https://twitter.com/cristianestali3/status/905456170613268482;cristianestali3;;2017-09-06 15:42:28+00:00;0;0;;;;"Estoy participando en el Sorteo con Múltiple Choice ""TRIVIA 1"" en 1er Festival Internacional de Artes Vivas Loja 201 https://goo.gl/QU5WH3"
1990;905451855324610560;https://twitter.com/juanfvaldivieso/status/905451855324610560;juanfvaldivieso;;2017-09-06 15:25:19+00:00;0;0;;;;"Estoy participando en el Sorteo con Múltiple Choice ""TRIVIA 1"" en 1er Festival Internacional de Artes Vivas Loja 201 https://goo.gl/QU5WH3"
1991;905434501530210305;https://twitter.com/sukys/status/905434501530210305;sukys;;2017-09-06 14:16:21+00:00;0;0;;;;"Estoy participando en el Sorteo con Múltiple Choice ""TRIVIA 1"" en 1er Festival Internacional de Artes Vivas Loja 201 https://goo.gl/QU5WH3"
1992;905423176724832261;https://twitter.com/zack_cabrera/status/905423176724832261;zack_cabrera;;2017-09-06 13:31:21+00:00;0;0;;;;"Estoy participando en el Sorteo con Múltiple Choice ""TRIVIA 1"" en 1er Festival Internacional de Artes Vivas Loja 201 https://goo.gl/QU5WH3"
1993;905283470087380992;https://twitter.com/GHELOP/status/905283470087380992;GHELOP;;2017-09-06 04:16:13+00:00;0;0;;;;"Estoy participando en el Sorteo con Múltiple Choice ""TRIVIA 1"" en 1er Festival Internacional de Artes Vivas Loja 201 https://goo.gl/QU5WH3"
1994;904889454875344896;https://twitter.com/PepeSimancasEc/status/904889454875344896;PepeSimancasEc;;2017-09-05 02:10:32+00:00;0;0;;;;"Estoy participando en Sorteo con Múltiple Choice ""TRIVIA 1"" en 1er Festival Internacional de Artes Vivas Loja 201 - https://goo.gl/QU5WH3"
1995;904768740398649345;https://twitter.com/Isaac_Freire_AM/status/904768740398649345;Isaac_Freire_AM;;2017-09-04 18:10:52+00:00;0;0;;;;"Estoy participando en el Sorteo con Múltiple Choice ""TRIVIA 1"" en 1er Festival Internacional de Artes Vivas Loja 201 https://goo.gl/QU5WH3"
1996;900369543620636674;https://twitter.com/FestivalDeLoja/status/900369543620636674;FestivalDeLoja;;2017-08-23 14:50:01+00:00;18;21;;#ElArteViveEnLoja;;¡Prepárate! En noviembre vuelve el Festival Internacional de Artes Vivas Loja 2017. ¡Esta vez no te lo puedes perder! #ElArteViveEnLoja
1997;900110346752577536;https://twitter.com/aldiacomec/status/900110346752577536;aldiacomec;;2017-08-22 21:40:04+00:00;1;0;;#Festival #Loja #Bus;;El Segundo #Festival Internacional de Artes Vivas en #Loja contará con un #Bus Eléctrico BYD. El bus tiene una... http://fb.me/51uA1O7E4
1998;899994128095772672;https://twitter.com/Cultura_Ec/status/899994128095772672;Cultura_Ec;;2017-08-22 13:58:15+00:00;9;10;@ElCiudadano_ec;;;Se espera más de 30.000 personas en el Festival de Artes Vivas Loja 2017 http://elciudadano.gob.ec/se-espera-mas-… vía @ElCiudadano_ec
1999;899818411273879553;https://twitter.com/tctelevision/status/899818411273879553;tctelevision;;2017-08-22 02:20:01+00:00;1;2;;;;Segunda Edición del Festival Internacional de Artes Vivas será en Loja. https://goo.gl/VsRHuH
2000;899784571289444354;https://twitter.com/sandraramon/status/899784571289444354;sandraramon;;2017-08-22 00:05:33+00:00;1;3;@YouTube;#Loja;;16 al 26 de noviembre en #Loja FESTIVAL INTERNACIONAL DE ARTES VIVAS LOJA 2017 https://youtu.be/EMQNIutneiA vía @YouTube
2001;899624074611232768;https://twitter.com/CartonPiedraET/status/899624074611232768;CartonPiedraET;;2017-08-21 13:27:48+00:00;3;2;@el_telegrafo @FestivalDeLoja;#Loja;;Esta es la ruta presupuestaria del Festival de las Artes Vivas de #Loja http://tinyurl.com/ydy7sevh Infografía en @el_telegrafo @FestivalDeLoja
2002;899303227132436480;https://twitter.com/SiguemeLoja/status/899303227132436480;SiguemeLoja;;2017-08-20 16:12:52+00:00;2;2;;#Loja;;#Loja | El Segundo Festival Internacional de Artes Vivas en Loja contará con un bus eléctrico BYD. 
2003;899127336087543808;https://twitter.com/ConectadosLoja/status/899127336087543808;ConectadosLoja;;2017-08-20 04:33:56+00:00;4;4;;#Loja;;"#Loja | El Segundo Festival Internacional de Artes Vivas en Loja contará con un bus eléctrico BYD. Via &gt; BYD Eléctrico Ecuador "
2004;899026228992065536;https://twitter.com/reviplanisferio/status/899026228992065536;reviplanisferio;;2017-08-19 21:52:10+00:00;1;1;;;;El Ministerio de Cultura presentó lo que será el Festival de Artes Vivas 2017 que se llevará acabo del 16 al 26 de noviembre en Loja. 
2005;898940435091128322;https://twitter.com/SalaDePrensaEc/status/898940435091128322;SalaDePrensaEc;;2017-08-19 16:11:15+00:00;1;0;;#Loja;;RT CartoNPiedraET: El Festival de las Artes Vivas de #Loja 2017 costará $3 millones: http://tinyurl.com/ydy7sevh Infografía en el_telegrafo.
2006;898931737467736066;https://twitter.com/CartonPiedraET/status/898931737467736066;CartonPiedraET;;2017-08-19 15:36:42+00:00;5;0;@el_telegrafo;#Loja;;El Festival de las Artes Vivas de #Loja 2017 costará $3 millones: http://tinyurl.com/ydy7sevh Infografía en @el_telegrafo.
2007;898635711250743297;https://twitter.com/confirmadonet/status/898635711250743297;confirmadonet;;2017-08-18 20:00:24+00:00;0;0;;;;Se espera más de 30.000 personas en el Festival de Artes Vivas Loja 2017 http://www.confirmado.net/se-espera-mas-30-000-personas-festival-artes-vivas-loja-2017/
2008;898592139034193921;https://twitter.com/MinturZonal7/status/898592139034193921;MinturZonal7;;2017-08-18 17:07:15+00:00;0;0;;;;[Destacado] Preparan en Ecuador II Festival Internacional de Artes Vivas de Loja. http://bit.ly/2fS6K4P
2009;898565655078862849;https://twitter.com/Cultura_Ec/status/898565655078862849;Cultura_Ec;;2017-08-18 15:22:01+00:00;11;13;@ElCiudadano_ec;;;Se espera más de 30.000 personas en el Festival de Artes Vivas Loja 2017 http://www.elciudadano.gob.ec/se-espera-mas-de-30-000-personas-en-el-festival-de-artes-vivas-loja-2017/ vía @ElCiudadano_EC
2010;898553429290655744;https://twitter.com/RevIndependien/status/898553429290655744;RevIndependien;;2017-08-18 14:33:26+00:00;0;0;;;;Loja/Loja. ARTES VIVAS. UN FESTIVAL DIFERENTE EN EL SUR DEL ECUADOR Se espera más de 3.000 personas en el... http://fb.me/6m75NevvE
2011;898341518611595264;https://twitter.com/radiocce/status/898341518611595264;radiocce;;2017-08-18 00:31:23+00:00;4;4;@Cultura_Ec;#ZonaCultura;;Es Oficial! #ZonaCultura estuvo en @Cultura_Ec para la convocatoria del Festival de Artes Vivas en Loja Se receptan propuestas hasta el 3/9 
2012;898326151143149568;https://twitter.com/mrmiseria/status/898326151143149568;mrmiseria;;2017-08-17 23:30:19+00:00;0;1;;;;Se espera más de 3.000 personas en el Festival de Artes Vivas Loja 2017 http://dlvr.it/PfqPwt
2013;898205795929796610;https://twitter.com/corapesatelital/status/898205795929796610;corapesatelital;;2017-08-17 15:32:04+00:00;1;0;;#Loja;;QUITO: Ministerio de Cultura convoca a colectivos y artistas a presentar sus propuestas artísticas para el Festival de Artes Vivas en #Loja 
2014;896099671327649792;https://twitter.com/patocarvajalg/status/896099671327649792;patocarvajalg;;2017-08-11 20:03:05+00:00;0;1;@ecuainm;;;"Ministro Raúl Pérez Torres ratifica que Festival de Artes Vivas de Loja se realizará en noviembre http://www.ecuadorinmediato.com/index.php?module=Noticias&amp;func=news_user_view&amp;id=2818824100 vía @ecuainm"
2015;895747779942916096;https://twitter.com/periodismoweb1/status/895747779942916096;periodismoweb1;;2017-08-10 20:44:47+00:00;0;0;;#Loja;;#Loja| Ministro Raúl Pérez, ratifica que II Festival Internacional de Artes Vivas 2017 se realizará en noviembre en la provincia de Loja.
2016;895681813472919552;https://twitter.com/GorkiAguirreT/status/895681813472919552;GorkiAguirreT;;2017-08-10 16:22:39+00:00;0;0;@Cultura_Ec @Cultura_Zonal7;;;"Ministro @Cultura_Ec ratifica que festival de Artes Vivas de Loja será en Noviembre @Cultura_Zonal7 http://ecuadorinmediato.com/index.php?module=Noticias&amp;func=news_user_view&amp;id=2818824100&amp;umt=ministro_raul_perez_torres_ratifica_que_festival_artes_vivas_loja_se_realizara_en_noviembre"
2017;895657683138883585;https://twitter.com/TurismoCuencaEC/status/895657683138883585;TurismoCuencaEC;;2017-08-10 14:46:46+00:00;1;1;;#Loja;;Ing Javier Carrion, Gerente de Descubriendo Ecuador invita a la ciudadanía al Festival de Artes Vivas 2017 en la Ciudad de #Loja 
2018;895649555743625216;https://twitter.com/CartonPiedraET/status/895649555743625216;CartonPiedraET;;2017-08-10 14:14:29+00:00;2;1;@FestivalDeLoja @el_telegrafo;;;La Contraloría examinará contrato para el Festival de las Artes Vivas de Loja (@FestivalDeLoja): http://tinyurl.com/y8f8t75n en @el_telegrafo.
2019;895267377566420992;https://twitter.com/alexismoncayo/status/895267377566420992;alexismoncayo;;2017-08-09 12:55:50+00:00;0;0;;;;"Ministro de Cultura Raúl Pérez T: Es imposible quitar a Loja una ciudad tan cultural el ""Festival de Artes Vivas"", será en noviembre"
2020;893849090508824577;https://twitter.com/FestivalDeLoja/status/893849090508824577;FestivalDeLoja;;2017-08-05 15:00:04+00:00;5;12;;#ElArteViveEnLoja;;El Festival Internacional de Artes Vivas Loja reúne lo mejor las artes escénicas del Ecuador y el mundo en un sólo lugar. #ElArteViveEnLoja
2021;892905378521817090;https://twitter.com/FestivalDeLoja/status/892905378521817090;FestivalDeLoja;;2017-08-03 00:30:06+00:00;6;20;;#ElArteViveEnLoja;;Vuelve el Festival de Artes Vivas en Loja este noviembre 2017. Espéralo muy pronto. #ElArteViveEnLoja
2022;892775706324815873;https://twitter.com/FestivalDeLoja/status/892775706324815873;FestivalDeLoja;;2017-08-02 15:54:50+00:00;7;8;;#ElArteViveEnLoja;;Te invitamos a disfrutar de las mejores obras, shows, música y más en el Festival Internacional de Artes Vivas Loja 2017. #ElArteViveEnLoja
2023;892109520226439168;https://twitter.com/FestivalDeLoja/status/892109520226439168;FestivalDeLoja;;2017-07-31 19:47:38+00:00;20;17;;#Ecuador;;#Ecuador te espera para disfrutar de Loja en el Festival Internacional de Artes Vivas de Loja 2017. ¡Te esperamos en noviembre! 
2024;891071312021647361;https://twitter.com/EcuadorWillana/status/891071312021647361;EcuadorWillana;;2017-07-28 23:02:10+00:00;0;0;;#Cultura;;"#Cultura Pérez Torres ""Festival de Artes Vivas se realizará en Loja"" - https://ecuadorwillana.com/2017/07/28/perez-torres-festival-artes-vivas-se-realizara-loja/"
2025;890742251491667968;https://twitter.com/EntornoNewss/status/890742251491667968;EntornoNewss;;2017-07-28 01:14:36+00:00;0;0;;#NoticiasNacionales;;#NoticiasNacionales FESTIVAL DE ARTES VIVAS 2017 SE REALIZARÁ EN LOJA Raúl Pérez Torres, ministro de Cultura... http://fb.me/8MhYYi6I0
2026;890726706759311360;https://twitter.com/shenoa1981/status/890726706759311360;shenoa1981;;2017-07-28 00:12:50+00:00;1;2;;;;Festival de Artes Vivas 2017 se realizará en Loja Raúl Pérez Torres, ministro de Cultura y Patrimonio cumplió... http://fb.me/aPhKsTpqX
2027;890677956384870400;https://twitter.com/FestivalDeLoja/status/890677956384870400;FestivalDeLoja;;2017-07-27 20:59:07+00:00;35;42;;#ElArteViveEnLoja;;300 artistas nacionales e internacionales participaron en el Festival Internacional de Artes Vivas Loja 2016. #ElArteViveEnLoja
2028;888380383783518208;https://twitter.com/Cultura_Ec/status/888380383783518208;Cultura_Ec;;2017-07-21 12:49:23+00:00;6;3;;#Ra #Loja;;"Ministro #RaúlPérezTorres: ""Vamos a tener grupos extraordinarios en el Festival de Artes Vivas de #Loja"""
2029;888380057894440960;https://twitter.com/Cultura_Ec/status/888380057894440960;Cultura_Ec;;2017-07-21 12:48:05+00:00;3;3;;#Ra #Loja;;"Ministro #RaúlPérezTorres: ""El Festival de Artes Vivas se hará en #Loja, es algo que no podemos cortar"""
2030;885890060750598145;https://twitter.com/radioluzyvidaec/status/885890060750598145;radioluzyvidaec;;2017-07-14 15:53:44+00:00;0;0;;;;La segunda edición del Festival Internacional de Artes Vivas de Loja (FIAV), que se realizará en noviembre, ya se... http://fb.me/1uSVT9HI7
2031;883341247225659394;https://twitter.com/SalaDePrensaEc/status/883341247225659394;SalaDePrensaEc;;2017-07-07 15:05:39+00:00;0;0;;;;RT CartoNPiedraET: La II y III edición del Festival de las Artes Vivas de Loja costará $6'272.000: http://tinyurl.com/y9fst9s9 en el_telegrafo.
2032;883340435506290690;https://twitter.com/CartonPiedraET/status/883340435506290690;CartonPiedraET;;2017-07-07 15:02:26+00:00;4;1;@el_telegrafo;;;La II y III edición del Festival de las Artes Vivas de Loja costará $6'272.000: http://tinyurl.com/y9fst9s9 en @el_telegrafo.
2033;882807150560653312;https://twitter.com/mleonm2002/status/882807150560653312;mleonm2002;;2017-07-06 03:43:21+00:00;0;2;;#CorreaEnPalabraSuelta;;#CorreaEnPalabraSuelta En tema de cultura q va a pasar con el Festival de Artes vivas de Loja ? Un abrazo desde Loja. Lo vamos a extrañar.
2034;882675225640529921;https://twitter.com/SalaDePrensaEc/status/882675225640529921;SalaDePrensaEc;;2017-07-05 18:59:07+00:00;0;0;;;;RT CartoNPiedraET: A mediados de junio, Raúl Pérez Torres anunció 'ajuste' en el Festival de las Artes Vivas de Loja: …
2035;882671898919927808;https://twitter.com/CartonPiedraET/status/882671898919927808;CartonPiedraET;;2017-07-05 18:45:54+00:00;8;3;@el_telegrafo;;;A mediados de junio, Raúl Pérez Torres anunció 'ajuste' en el Festival de las Artes Vivas de Loja: http://tinyurl.com/y8979tan en @el_telegrafo.
2036;882653477842952192;https://twitter.com/CartonPiedraET/status/882653477842952192;CartonPiedraET;;2017-07-05 17:32:42+00:00;8;2;@el_telegrafo;#Loja;;Ediciones 2017 y 2018 del Festival Internacional de las Artes Vivas de #Loja costarán $6'272.000: http://tinyurl.com/yczzll32 en @el_telegrafo.
2037;875541933124460544;https://twitter.com/editoa/status/875541933124460544;editoa;;2017-06-16 02:33:58+00:00;2;3;@MashiRafael;#Loja #Festival;;En #Loja teatros para el arte y la cultura, gracias @MashiRafael, la cita es en noviembre #Festival de artes Vivas 
2038;875514393072734208;https://twitter.com/JcMixterDJ/status/875514393072734208;JcMixterDJ;;2017-06-16 00:44:32+00:00;0;0;;#FestivalViveEnLoja;;#2017 Festival de Artes vivas en Loja #FestivalViveEnLoja
2039;875486254162481153;https://twitter.com/miregionec/status/875486254162481153;miregionec;;2017-06-15 22:52:43+00:00;0;0;;;;Festival de Artes Vivas en Loja tiene buenas perspectivas http://miregion.ec/contenido-general/festival-de-artes-vivas-en-loja-tiene-buenas-perspectivas
2040;875485015718719488;https://twitter.com/miregionec/status/875485015718719488;miregionec;;2017-06-15 22:47:48+00:00;0;0;;;;Festival de Artes Vivas en Loja tiene buenas perspectivas http://miregion.ec/node/2792
2041;875332909623889921;https://twitter.com/GoberLoja/status/875332909623889921;GoberLoja;;2017-06-15 12:43:23+00:00;37;21;@johaortizv;;;En el 2016, Loja superó las expectativas en la organización del Festival de Artes Vivas y nos preparamos para la segunda edición @johaortizv
2042;874846765534633985;https://twitter.com/ConectadosLoja/status/874846765534633985;ConectadosLoja;;2017-06-14 04:31:37+00:00;3;4;;#Loja #FestivalViveEnLoja;;#Loja volverá a disfrutar del Festival de Artes Vivas que se realizará en noviembre, todos invitados porque el #FestivalViveEnLoja .
2043;874839146619121665;https://twitter.com/VistoLoja/status/874839146619121665;VistoLoja;;2017-06-14 04:01:20+00:00;10;9;;#Loja #FestivalViveEnLoja;;Más de 31.000 personas disfrutaron de la agenda en el Primer Festival de Artes Vivas en #Loja. Alistan segunda edición #FestivalViveEnLoja 
2044;874700817101672448;https://twitter.com/hugopitisaca/status/874700817101672448;hugopitisaca;;2017-06-13 18:51:40+00:00;5;6;@MashiRafael @Lenin;#Loja;;#Loja te recibe con afecto y alegría en el Festival de Artes Vivas 2017 @MashiRafael @Lenin
2045;874696435798867970;https://twitter.com/maitaespinoza/status/874696435798867970;maitaespinoza;;2017-06-13 18:34:16+00:00;0;2;;#LojaDefiendeSuFestival #FestivalViveEnLoja;;Las familias Lojanas somos arte y cultura, Festival de Artes Vivas en Loja. #LojaDefiendeSuFestival #FestivalViveEnLoja
2046;874696151173394432;https://twitter.com/maitaespinoza/status/874696151173394432;maitaespinoza;;2017-06-13 18:33:08+00:00;4;3;;#LojaDefiendeSuFestival #FestivalViveEnLoja;;Los Lojanos somos arte y cultura. Festival de Artes Vivas en Loja. #LojaDefiendeSuFestival #FestivalViveEnLoja
2047;874689943368597505;https://twitter.com/maitaespinoza/status/874689943368597505;maitaespinoza;;2017-06-13 18:08:28+00:00;0;1;;#LojaDefiendeSuFestival #FestivalViveEnLoja;;Todos los lojanos hacemos cultura, Festival de Artes Vivas en Loja. #LojaDefiendeSuFestival #FestivalViveEnLoja
2048;874689859188912128;https://twitter.com/maitaespinoza/status/874689859188912128;maitaespinoza;;2017-06-13 18:08:08+00:00;0;1;;#LojaDefiendeSuFestival #FestivalViveEnLoja;;Los lojanos hacemos cultura, Festival de Artes Vivas en Loja. #LojaDefiendeSuFestival #FestivalViveEnLoja
2049;874681246303096833;https://twitter.com/FannyCueva1/status/874681246303096833;FannyCueva1;;2017-06-13 17:33:54+00:00;3;3;;;;Como ciudadanos lojanos defendemos el Festival Internacional de Artes Vivas con su sede permanente en Loja. Confiamos en el Presidente Lenin 
2050;874672460918136832;https://twitter.com/competenciascnc/status/874672460918136832;competenciascnc;;2017-06-13 16:58:59+00:00;6;3;;#Loja #FestivalViveEnLoja;;#Loja destino de arte y cultura se prepara para recibir al mundo en el 2do. Festival Internacional de Artes Vivas 2017. #FestivalViveEnLoja
2051;874670600496852992;https://twitter.com/alexito_romero/status/874670600496852992;alexito_romero;;2017-06-13 16:51:36+00:00;4;7;;#loja #LojaDefiendeSuFestival;;Si la inversión para el festival de artes vivas fuera en Quito, Guayas o Cuenca, nadie dijera nada, pero es en #loja #LojaDefiendeSuFestival
2052;874668131029012480;https://twitter.com/Lopez2Ale/status/874668131029012480;Lopez2Ale;Cultura_Ec;2017-06-13 16:41:47+00:00;1;2;;#Ra #FestivalViveEnLoja;;El Segundo Festival Internacional de Artes Vivas, como lo ha ratificado el ministro #RaúlPérezTorres, será en Loja. #FestivalViveEnLoja
2053;874663611351879682;https://twitter.com/RosarioCordovaV/status/874663611351879682;RosarioCordovaV;Cultura_Ec;2017-06-13 16:23:50+00:00;7;3;@Cultura_Ec;#Loja #FestivalViveEnLoja;;.@Cultura_Ec ratifica la realización del Segundo Festival de Artes Vivas en #Loja #FestivalViveEnLoja 
2054;874659691384754176;https://twitter.com/Cultura_Ec/status/874659691384754176;Cultura_Ec;;2017-06-13 16:08:15+00:00;131;84;;#Ra #FestivalViveEnLoja;;El Segundo Festival Internacional de Artes Vivas, como lo ha ratificado el ministro #RaúlPérezTorres, será en Loja. #FestivalViveEnLoja
2055;874659383124402177;https://twitter.com/TeatroBenjaminC/status/874659383124402177;TeatroBenjaminC;;2017-06-13 16:07:01+00:00;1;1;;;;Más de 31 mil personas disfrutaron del Festival Internacional de Artes Vivas Loja 2016, en 2017 superaremos esa... http://fb.me/aEoasGHG9
2056;874659355697741824;https://twitter.com/TeatroBenjaminC/status/874659355697741824;TeatroBenjaminC;;2017-06-13 16:06:55+00:00;20;10;;#FestivalViveEnLoja;;Más de 31 mil personas disfrutaron del Festival Internacional de Artes Vivas Loja 2016, en 2017 superaremos esa cifra #FestivalViveEnLoja
2057;874658986376781824;https://twitter.com/TeatroBenjaminC/status/874658986376781824;TeatroBenjaminC;;2017-06-13 16:05:27+00:00;0;1;;;;Más de 31 mil personas disfrutaron del Festival Internacional de Artes Vivas Loja 2016, en 2017 superaremos esa... http://fb.me/13UzzE5GF
2058;874652781797404672;https://twitter.com/Cultura_Ec/status/874652781797404672;Cultura_Ec;;2017-06-13 15:40:48+00:00;97;49;;#FestivalViveEnLoja;;Más de 31 mil personas disfrutaron del Festival Internacional de Artes Vivas Loja 2016, en 2017 superaremos esa cifra. #FestivalViveEnLoja
2059;874649417432870912;https://twitter.com/LojaRevolucion/status/874649417432870912;LojaRevolucion;;2017-06-13 15:27:25+00:00;19;8;@Lenin;#FestivalViveEnLoja;;Loja cuenta con usted Presidente @Lenin para fortalecer el Festival de Artes Vivas en Loja #FestivalViveEnLoja
2060;874641673938010112;https://twitter.com/ArmandoJenn/status/874641673938010112;ArmandoJenn;;2017-06-13 14:56:39+00:00;0;0;;;;Como ciudadanos lojanos defendemos el Festival Internacional de Artes Vivas con su sede permanente en Loja.... http://fb.me/275riLDzu
2061;874640336810672128;https://twitter.com/ArmandoJenn/status/874640336810672128;ArmandoJenn;;2017-06-13 14:51:20+00:00;0;0;;;;Como ciudadanos lojanos defendemos el Festival Internacional de Artes Vivas con su sede permanente en Loja.... http://fb.me/4rQ6BW8sN
2062;874639914087862272;https://twitter.com/ArmandoJenn/status/874639914087862272;ArmandoJenn;;2017-06-13 14:49:40+00:00;0;0;;;;Como ciudadanos lojanos defendemos el Festival Internacional de Artes Vivas con su sede permanente en Loja.... http://fb.me/yhWWlFe4
2063;874632517277458432;https://twitter.com/ArmandoJenn/status/874632517277458432;ArmandoJenn;;2017-06-13 14:20:16+00:00;0;0;;;;Como ciudadanos lojanos defendemos el Festival Internacional de Artes Vivas con su sede permanente en Loja.... http://fb.me/61DENNLsd
2064;872321705431183361;https://twitter.com/ALFONMSO12345/status/872321705431183361;ALFONMSO12345;Lenin;2017-06-07 05:17:56+00:00;0;0;;;;Señor Presidente, saludos cordiales, pido su apoyo para que se lleve a efecto el Festival de Artes Vivas y la Bienal en Loja en noviembre 17
2065;867762223770460160;https://twitter.com/MunicipioDeLoja/status/867762223770460160;MunicipioDeLoja;;2017-05-25 15:20:11+00:00;2;2;@chatojobol;#RuedaDePrensa;;@chatojobol | El Festival Internacional de Artes Vivas en Loja este año será de música y arte. #RuedaDePrensa
2066;867177864248143872;https://twitter.com/wilson_29R/status/867177864248143872;wilson_29R;;2017-05-24 00:38:08+00:00;0;0;@MashiRafael;#Loja;;Mediante Decreto 1416 @MashiRafael declara al Festival de Artes Vivas como un evento recurrente y prioritario a desarrollarse en #Loja 
2067;865658377136775168;https://twitter.com/Jeancsotomayor/status/865658377136775168;Jeancsotomayor;;2017-05-19 20:00:14+00:00;1;0;;#UdlaEnEDOC;;El panelistas Robertos Almendariz cuestiona el festival de artes vivas que se realiza en Loja #UdlaEnEDOC
2068;865650890245521408;https://twitter.com/Gutembergst/status/865650890245521408;Gutembergst;;2017-05-19 19:30:29+00:00;0;0;;;;R. Correa decreta como prioritario el Festival Internacional de Artes Vivas en Loja porque seudoartistas quieren que todo siga centralizado
2069;865383984397791232;https://twitter.com/ximealito/status/865383984397791232;ximealito;;2017-05-19 01:49:54+00:00;0;1;@MashiRafael;#Loja #LojaCentroDeArteYCultura;;Decreto firmado por @MashiRafael denominando prioridad institucional anual al Festival de artes vivas en #Loja #LojaCentroDeArteYCultura
2070;865361462109368320;https://twitter.com/TECSERLED/status/865361462109368320;TECSERLED;;2017-05-19 00:20:24+00:00;0;0;;;;No habrá festival de YULIN...Pero habrá festival de las artes vivas en Loja... Ya saben que va a pasar porque se... http://fb.me/6XJZ5JhZ3
2071;865289287587201025;https://twitter.com/CorruptaPrensa/status/865289287587201025;CorruptaPrensa;;2017-05-18 19:33:37+00:00;0;0;;;;Festival de Artes Vivas de Loja pasa a ser último en su período presidencial. No te lo pierda…
2072;865283601679736833;https://twitter.com/culturalojana/status/865283601679736833;culturalojana;QueHayEnLoja;2017-05-18 19:11:01+00:00;0;3;;#CulturaLojana #FIAVL;;¡ATENCIÓN! Muy buena noticia para Loja. El Festival de Artes Vivas seguirá en nuestra ciudad. #CulturaLojana #FIAVL
2073;865276443487612928;https://twitter.com/RosarioCordovaV/status/865276443487612928;RosarioCordovaV;;2017-05-18 18:42:34+00:00;36;29;@MashiRafael;#Loja;;Aquí Decreto 1416 donde @MashiRafael declara al Festival de Artes Vivas como un evento recurrente y prioritario, a desarrollarse en #Loja 
